id,yearDisplay,yearSort,genre,icon,events,movieList,movieGenres,movieEvents,realEvents,realCulture
80,1987年,1987.1,ドラマ,🌻,長崎から上京してきた楽天的な青年・横道世之介が、東京での大学生活でさまざまな人々と出会い、日常の些細な喜びを積み重ねた。後に彼と関わった人々は、ふとした瞬間にその笑顔を思い出した。,横道世之介,,,国鉄が民営化しJRが発足。東京の新宿・池袋などのターミナル開発が加速した。,ユーミン（松任谷由実）の「リゾート感」が東京の若者文化を形作っていた。バブル前夜のリゾートブーム。
81,1989年,1989.0,アクション,🔫,東京都内を管轄する短気で暴力的な刑事が、独断で麻薬密売組織の捜査に挑んだ。,その男、凶暴につき,,,昭和天皇が崩御し平成元年が始まった。消費税3%が導入され、ベルリンの壁が崩壊した。,昭和から平成へ。バブル絶頂、ジュリアナ東京が翌年開業。宮崎勤事件後のオタク叩きが起きた複雑な転換期。
82,1999年,1999.1,コメディ,☀️,東京の下町に暮らす少年が、夏休みに遠くの母親を訪ねる旅に出た。ギャンブル好きの近所のおじさんが珍道中に同行し、旅先で奇妙な人情に出会った。,菊次郎の夏,,,東京湾アクアラインが開通。地下鉄サリン事件のオウム裁判が続き、東京の安全神話は揺らいでいた。,「マトリックス」公開、世紀末ブーム。モーニング娘。がテレビを席巻。秋葉原にアイドル文化が形成された。
83,2001年,2001.1,ドラマ,✊,東京に暮らす在日コリアンの高校生が、日常の差別と民族的アイデンティティに向き合いながら、一人の日本人女性との純粋な恋愛を通じて自らの生き方を模索した。怒りとユーモアで貫かれた都市の青春。,Go!,,,東京では在日外国人への差別問題が社会的議論に。外国籍住民の増加が続いた。,「千と千尋の神隠し」が興行収入記録更新。同時多発テロ後、日本のコンテンツ産業に影響が出た。
84,2002年,2002.1,ホラー,👁️,東京都内の一軒家に棲み着いた呪いが、家を訪れた者すべてに死をもたらした。怨霊「伽椰子」と「俊雄」による呪いの連鎖は時空を超えて拡散し、都市の日常に恐怖が染み込んでいった。,呪怨,,,日韓共催W杯が開催。東京・渋谷でサポーターが交差点に溢れ出した。,ワールドカップ共催年。「猟奇的な彼女」が東京でヒット。韓流の前兆として韓国文化が浸透し始めた。
85,2006年,2006.1,アクション,🏎️,アメリカから東京に転校してきた高校生が、首都高速や繁華街の地下ドリフトレース世界に足を踏み入れた。東京の夜景を背景に、異文化がぶつかり合い、友情が生まれた。,ワイルド・スピードX3 TOKYO DRIFT,,,東京都内のマンション価格が上昇を始め、都心部の再開発ラッシュが本格化した。,ニコニコ動画創設前夜。東京発のオタク文化がクール・ジャパンとして政策的に後押しされ始めた。
86,2006年,2006.2,ドラマ,🗼,九州から上京し東京でひとり暮らしを続けてきた息子が、ガンを患ったオカンを東京に呼び寄せた。東京タワーを望む街で、母と息子は最後の日々を過ごした。,東京タワー オカンとボクと、時々、オトン,,,東京タワー開業48周年。スカイツリーの建設計画が正式に発表された。,東京タワー開業50周年。倖田來未・大塚愛らがJ-POP市場を牽引。団塊世代の退職が懐古文化ブームを生んだ。
87,2006年,2006.3,ドラマ,🌆,東京に暮らす聴覚障害を持つ女子高生が、父親との断絶と孤独を抱えながら渋谷の夜の街を彷徨い、刹那的な繋がりを求め続けた。,バベル,,,東京都で「日の丸・君が代」問題が政治的議論を呼んだ。格差拡大への批判が高まった。,「時をかける少女」（アニメ版）公開。新海誠の「秒速5センチメートル」が翌年公開。アニメ映画の多様化が加速した。
88,2007年,2007.1,ドラマ,🏳️,東京近郊のどこにでもある市街地で、役所の担当者を通じてとなり町との「戦争」が淡々と遂行されていることが明らかになった。戦死者が出ても日常は続き、戦争の実感なき市民生活が描かれた。,となり町戦争,,,東京周辺で都市型水害が頻発。地下鉄・下水道の排水容量不足が深刻な問題となった。,iPhone登場直後。mixiからTwitterへの移行期。東京のクリエイターたちがSNSで作品発信を始めた転換期。
89,2008年,2008.1,ドラマ,🐍,東京の歓楽街に生きる若い女性が、舌のピアスと刺青を身に纏いながら自己破壊的な欲望の渦に深く沈んでいった。都市の底辺で、性と暴力と死が渦を巻いた。,蛇にピアス,,,リーマンショックで東京の雇用が悪化。日比谷公園に「年越し派遣村」が設置された。,リーマンショック。AKB48「会いに行けるアイドル」が台頭。東京の歓楽街で格差と欲望が交錯した時代。
90,2012年,2012.1,ドラマ,💸,東京の下町で焼き鳥屋を営む夫婦が火事で店を失い、夫は再起のために結婚詐欺師となる道を選んだ。孤独な女性たちの欲望につけ込みながら、夫婦の歪んだ愛憎は深まっていった。,夢売るふたり,,,東日本大震災から復興途上の中、東京でも節電と復興支援の取り組みが続いた。,スカイツリー開業・東京駅丸の内駅舎復元。AKB総選挙が社会現象に。「孤独のグルメ」で下町食文化が再注目された。
91,2019年,2019.1,サスペンス,🎭,東京都心の高級ホテルに連続殺人犯が現れるという予告を受け、警視庁の刑事がホテルスタッフに扮して潜入捜査を展開した。仮面をつけた都市生活者たちの素顔が行き交う空間での心理戦。,マスカレードホテル,,,消費税が10%に引き上げられた。令和元年、東京では新時代の幕開けに沸いた。,令和元年。サブスクリプション型音楽配信が完全定着し、CDは「コレクターズアイテム」化した。
