id,yearDisplay,yearSort,genre,icon,events,movieList,movieGenres,movieEvents,realEvents,realCulture
31,1980年代後半,1985.0,ドラマ,📷,バブル景気が狂乱する1980年代後半の東京は内外から異なる視点で切り取られた。ヴェンダースのカメラは屋上のゴルフ練習場と原宿のネオンが生む都市の迷宮を映し、一方で架空の世界線では突如として東京が半径30キロの巨大な雲に完全に覆われ外部と遮断された。,東京画|首都消失,,バブル景気の絶頂期、ヴィム・ヴェンダースのカメラがビルの屋上のゴルフ練習場と原宿のネオンが生む東京の奇妙な迷宮を記録した。|突如東京が半径30キロにわたる巨大な「雲（物体O）」に完全に覆い尽くされ外部との通信や交通が一切遮断されるという未曾有の異常事態が発生した。,バブル経済が本格化し東京の地価が急騰。バブル最盛期、六本木・赤坂のディスコが若者で溢れ東京は「不夜城」と化した。,バンドブーム到来。BOΦWYらが登場し渋谷・原宿がティーンの聖地に。ジュリアナ東京前夜のお立ち台ディスコ文化と超高額アートオークションが同時進行した。
32,1986年,1986.0,ドラマ,🎵,バブル前夜のエネルギッシュな東京において、アメリカから来た女性がロックバンドの青年と出会い、音楽チャートを駆け上がる事象が発生した。,TOKYO POP,,,バブル景気の絶頂。東京の株価・不動産が異常高騰し、世界最高コストの都市と呼ばれた。,バブル景気の始まり。ディスコ文化全盛。東京のアート・デザイン分野への投資が活発化した。
80,1987年,1987.1,ドラマ,🌻,国鉄が民営化しJR発足の1987年、東京では対照的な二つの物語が進んだ。長崎から上京した楽天的な青年が大学生活で日常の喜びを積み重ねる一方、国税局の女性調査官がラブホテル経営者の巧妙な脱税を追いバブル前夜の現金経済の闇を暴いた。,横道世之介|マルサの女,,長崎から上京してきた楽天的な青年・横道世之介が東京での大学生活でさまざまな人々と出会い日常の些細な喜びを積み重ねた。|国税局査察部（マルサ）の女性調査官がラブホテル経営者の巧妙な脱税トリックを追い東京のパチンコ店・飲食店の現金商売から隠し財産を掘り起こした。,国鉄が民営化しJRが発足。東京の新宿・池袋などのターミナル開発が加速した。バブル景気前夜の東京で地価高騰・不動産投機が過熱し現金脱税が横行した。,ユーミン（松任谷由実）の「リゾート感」が東京の若者文化を形作った。第11回日本アカデミー賞を「マルサの女」が主要部門独占した。バブル前夜の消費文化全盛期。
34,1988年,1988.0,ドラマ,🏙️,昭和最後の年1988年の東京は複数の時間軸が交差した。都会の死角では誰にも知られずに子供たちが身を寄せ合って生き、遠い未来の架空の東京では新型爆弾が炸裂して旧東京が消滅した。浅草の脚本家はかつての下町を再訪し事故死した両親の幻影と夏の終わりに再会した。,誰も知らない|AKIRA|異人たちとの夏,,実際の巣鴨子供置き去り事件をモチーフに都会の死角で身を寄せ合って生きる子供たちの姿が確認された。|関東地区において謎の「新型爆弾」が炸裂して第三次世界大戦が勃発し旧東京は完全に消滅した。|浅草に暮らす独身の脚本家が夏のある日かつて育った下町を再訪し幼少期に事故死した両親の幻影と不思議な再会を繰り返した。,東京ドームが開場。昭和天皇の病状悪化が報道され全国に自粛ムードが広がった。バブル経済絶頂期、東京の地価は狂乱的に高騰し昭和の下町風景が次々と消えていった。,「火垂るの墓」「となりのトトロ」同時公開でスタジオジブリが新時代を開いた。ゲーム文化が東京の子供たちを席巻し秋葉原が電気街からゲーム・アニメの街へ変貌し始めた。
81,1989年,1989.0,アクション,🔫,東京都内を管轄する短気で暴力的な刑事が、独断で麻薬密売組織の捜査に挑んだ。,その男、凶暴につき,,,昭和天皇が崩御し平成元年が始まった。消費税3%が導入され、ベルリンの壁が崩壊した。,昭和から平成へ。バブル絶頂、ジュリアナ東京が翌年開業。宮崎勤事件後のオタク叩きが起きた複雑な転換期。
127,1991年,1991.0,コメディ,🤼,東京のある大学で廃部寸前の相撲部に半強制的に入部させられた学生たちが個性豊かな仲間とともに練習に励み地区大会出場を目指してぶつかり合った。,シコふんじゃった。,,,1991年バブル経済が崩壊し株価・地価が急落した。東京では不動産価格の下落が始まり過剰融資に頼った企業・金融機関が打撃を受けた。,バブル崩壊直後の東京では過熱した消費文化への反省が広がり等身大の日常や学生生活を描いたコメディ映画・青春ドラマが若者の共感を集めた。
70,1993年,1993.0,コメディ,🌑,バブル崩壊後の1993年の東京で都市の二つの裏面が露出した。都心の高級ホテルに暴力団が潜り込みゆすりを繰り返す実態を女性弁護士が法で撃退した一方、渋谷のストリップ劇場を拠点に欲望・暴力・裏切りが交錯する女の物語が東京アンダーグラウンドに燃えていた。,ミンボーの女|ヌードの夜,,東京都心の高級ホテルに組織暴力団が潜り込み恐喝・ゆすり（ミンボー）を繰り返す実態が明らかになり女性弁護士が法律と機転で暴力と戦った。|渋谷のストリップ劇場を拠点に生きる女性と彼女に関わる男たちの欲望・暴力・裏切りが交錯しバブル崩壊後の東京アンダーグラウンドを鮮烈に描いた。,非自民8党派連立による細川内閣が発足し55年体制が崩壊。バブル崩壊後の東京で企業倒産が相次ぎ渋谷・新宿では失業者や若者の漂流が目立ち始めた。,J-POP黄金時代前夜。渋谷系が文化的潮流に。Jリーグ開幕で東京にスポーツ文化が定着した。「Vシネマ」が隆盛しアングラ映画が独自の市場を形成した。
36,1990年代後半,1995.0,ホラー,📼,バブル後の1990年代後半、東京の恐怖と欲望は二つの形をとった。「見ると1週間で死ぬビデオテープ」による連続不審死が伊豆大島から東京に広がる一方、円が世界最強通貨となった近未来の移民街「円都」で娼婦と孤児が億万長者の夢を追った。,リング|スワロウテイル,,伊豆大島から始まり東京などに広がった「見ると1週間後に死ぬビデオテープ」による連続不審死事件が発生した。|「円」が世界最強通貨の近未来日本の移民街「円都（イェン・タウン）」で娼婦グリコと孤児アゲハが紙幣偽造データを手に入れ億万長者となった。,バブル崩壊後の不況が長期化し山一證券が自主廃業し金融危機が顕在化した。阪神淡路大震災・地下鉄サリン事件の余波が続き経済格差拡大と外国人労働者問題が顕在化した。,ビジュアル系バンドと渋谷系音楽が東京文化の両極を形成。「もののけ姫」「新世紀エヴァンゲリオン」が日本アニメ・サブカルの世界的認知を加速させた。
71,1996年,1996.0,コメディ,💃,東京郊外に暮らす平凡なサラリーマンが電車の窓越しに見えたダンス教室の美しい講師に惹かれ社交ダンスを習い始め個性的な仲間との交流を通じて生きがいを取り戻した。,Shall We ダンス?,,,バブル崩壊後の不況が長期化する1990年代半ば、東京では企業のリストラが本格化し失業率が上昇した。地下鉄サリン事件（1995年）の余波で都市の安全神話も揺らいでいた時代。,日本アカデミー賞13部門独占の大ヒット。バブル崩壊後の「失われた10年」に生きる普通の人々の自己実現を描き後にリチャード・ギア主演でハリウッドリメイクされた。
37,1997年,1997.0,コメディ,🚓,1997年の東京に二種類の異常が走った。お台場臨海副都心の開発が進む中湾岸署の青島刑事がさまざまな事件に奔走した一方、都内各地では謎の記憶喪失の男が引き起こす連続殺人が発生し刑事・高部の「自我」そのものが侵食されていった。,踊る大捜査線|CURE,,お台場が空き地から巨大観光地へと開発されていく過程で青島刑事が湾岸署を舞台に様々な事件の捜査に奔走した。|東京各地で謎の記憶喪失の男が引き起こした連続殺人事件が発生し刑事・高部は真相を追ううちに自身の「自我」が侵食されていく恐怖に直面した。,消費税が5%に引き上げられ景気が後退。お台場・臨海副都心の開発が本格化した。神戸連続児童殺傷事件で社会が震撼し東京でも犯罪の凶悪化・匿名化が深刻に議論された。,「もののけ姫」「新世紀エヴァンゲリオン」が日本アニメの新時代を開いた。東京発のJホラーが世界的注目を集め黒沢清らが独自の恐怖映像言語を確立しつつあった。
38,1998年,1998.0,サスペンス,🌸,1998年の東京では若者たちの孤独と欲望が三つの街で進行した。下北沢の開かずの踏切では謎の発砲魔と彼に恋する女の物語が展開し、武蔵野に引っ越した女子大生が「東京」という場所そのものと向き合い、渋谷センター街では女子高生4人組がブランドのリングを求め欲望の深みに晒された。,TOKYO EYES|四月物語|ラブ&ポップ,,下北沢の1時間に10分しか開かない「開かずの踏切」付近において謎の無差別発砲魔と彼に恋する女の物語が展開された。|北海道から上京した女子大生が4月のある午後武蔵野の街に溶け込みながら東京での一人暮らしを始め「東京」という場所そのものと静かに向き合った。|渋谷でブランドのリングを手に入れようとする女子高生4人組が一日の間に東京の欲望と現実の深みに晒されていった。,長野オリンピックが開催。東京では外資系企業の進出が相次いだ。渋谷センター街では援助交際・コギャル文化が社会問題化した。宇多田ヒカルがデビューしJ-POP黄金時代が最高潮に達した。,渋谷109を中心とするギャル文化が全盛期。ルーズソックス・コギャルファッションが東京発の若者文化として全国に広まった。1990年代末の武蔵野・吉祥寺界隈が若者のカルチャー発信地として多く描かれた。
39,1999年,1999.0,アニメ,⚠️,ミレニアム前夜の1999年の東京湾岸は二重の危機に見舞われた。廃棄構造物からのコンピュータウイルス拡散を阻止すべくパトレイバーが決死の解体作戦を展開しお台場では子供たちがデジタルワールドとの境界崩壊に挑んだ。一方で下町の少年とギャンブル好きのおじさんが夏の珍道中に出た。,機動警察パトレイバー the Movie|デジモンアドベンチャー|菊次郎の夏,アニメ|アニメ,東京湾に浮かぶ廃棄構造物「方舟」からのコンピュータウイルス拡散を阻止するため警察特殊部隊による解体作戦が決行された。|お台場や光が丘においてデジタルワールドと現実世界の境界が崩壊し子供たちと異形の生命体による戦闘が目撃された。|東京の下町に暮らす少年が夏休みに遠くの母親を訪ねる旅に出ギャンブル好きの近所のおじさんが珍道中に同行した。,Y2K問題への対応でIT企業が多忙を極めた。地下鉄サリン事件のオウム裁判が佳境を迎えた。東京湾アクアラインが開通した。ミレニアム前夜の渋谷センター街のギャル文化が最盛期。,ミレニアム前夜。モーニング娘。がテレビを席巻。秋葉原にアイドル文化が形成され始めた。「マトリックス」公開で世紀末ブームが高まった。
40,2000年,2000.0,アニメ,⚠️,「セカンドインパクト」および新型爆弾の投下により東京都が完全に壊滅した。,新世紀エヴァンゲリオン,,,2000年問題は大きな混乱なく通過。石原慎太郎が東京都知事に当選し「都市再生」を掲げた。,ミレニアム。着メロ文化とケータイ小説の原型が生まれ、モバイル文化の幕が開いた。
43,2001年,2001.0,アクション,🌿,2001年の東京では外側からやってきた二人の男が異なる戦いを繰り広げた。フランス人刑事が娘をヤクザから守るため東京で戦い、在日コリアンの高校生が日常の差別とアイデンティティに向き合いながら日本人女性との純粋な恋を貫いた。,WASABI|Go!,,19年前に姿を消した最愛の女性の死を知りフランスの警察官がヤクザから娘を守るため東京において戦闘を繰り広げた。|東京に暮らす在日コリアンの高校生が日常の差別と民族的アイデンティティに向き合いながら一人の日本人女性との純粋な恋愛を通じて自らの生き方を模索した。,六本木ヒルズが開業した。東京では在日外国人への差別問題が社会的議論に。同時多発テロ後東京でも警備が強化された。,「千と千尋の神隠し」が興行収入記録を塗り替えた。ポケモン・ハリポタが同時代に子供たちを席巻した。東京に多様な外国文化が流入し始めた。
41,2000年代前半,2002.0,アニメ,📓,名前を書かれた人間が死に至る謎のノートを用いた連続殺人事件が発生し、警視庁に設置された捜査本部と世界最高峰の名探偵が頭脳戦を繰り広げた。,DEATH NOTE,,,9.11同時多発テロで東京でも警備が強化。インターネット普及率が急上昇した。,日韓ワールドカップ開催。「冬のソナタ」韓流ブームの前夜。東京に多様な外国文化が流入し始めた。
84,2002年,2002.1,ホラー,👁️,東京都内の一軒家に棲み着いた呪いが、家を訪れた者すべてに死をもたらした。怨霊「伽椰子」と「俊雄」による呪いの連鎖は時空を超えて拡散し、都市の日常に恐怖が染み込んでいった。,呪怨,,,日韓共催W杯が開催。東京・渋谷でサポーターが交差点に溢れ出した。,ワールドカップ共催年。「猟奇的な彼女」が東京でヒット。韓流の前兆として韓国文化が浸透し始めた。
44,2003年,2003.0,SF,🎄,2003年のクリスマス、東京では複数の事件が同時に起きていた。新宿のホテルでは言葉の通じない男女が窓の外の夜景を見つめ、お台場ではゴジラとメカゴジラが激突してレインボーブリッジ周辺は大混乱に陥っていた。その夜、路地裏では3人のホームレスが拾った赤ちゃんを抱えて都内を走り回っていた。,ロスト・イン・トランスレーション|東京ゴッドファーザーズ|ゴジラ×モスラ×メカゴジラ 東京SOS|踊る大捜査線 THE MOVIE 2 レインボーブリッジを封鎖せよ！,ドラマ|アニメ|SF|コメディ,新宿の高層ホテルに滞在した外国人二人が、言葉も文化も通じない東京の夜に孤独を分かち合った。|クリスマスの夜、東京の路上生活者3人が捨てられた赤ちゃんを拾い、本当の親を探して都内を奔走した。|東京湾からゴジラが上陸し、機械仕掛けのメカゴジラとの死闘が都心部で繰り広げられた。|お台場での連続殺人事件を受け、警察はレインボーブリッジを完全封鎖した。,イラク戦争が勃発し東京でも大規模な反戦デモが行われた。六本木ヒルズ開業で都市景観が一変した。,東京発ファッションがパリコレに進出し始めた。ケータイ文化が最盛期で電車内はみんなケータイを見ていた。
45,2004年,2004.0,ドラマ,☕,神保町の純喫茶などにおいて、東京人の生活のディテールが息づく静かな時間が観測された。,珈琲時光,,,東京で「ニート」問題が社会的議論に。新宿区でゴミ有料化が導入された。,「ハウルの動く城」公開。ケータイ文化の全盛期。着うたフルが登場し、音楽の聴き方が変わった。
72,2005年,2005.0,コメディ,,秋葉原在住の青年が電車内で痴漢から女性を救ったことをネット掲示板に投稿したところ、数千人の「住人」たちに見守られながら生まれて初めての恋愛に挑む事案が発生した。,電車男,,,JR福知山線脱線事故が発生。東京では「格差社会」論争が始まり、ワーキングプアが注目された。,愛知万博開催。日本映画の国際評価が高まり、是枝裕和・宮崎駿作品が海外賞を受賞し続けた。
42,2000年代後半,2006.0,アニメ,🏍️,2000年代の池袋は、まともではなかった。首のない黒い影が夜の大通りを疾走し、カラーギャングが血みどろの縄張り争いを繰り広げた。その混乱を何度もやり直しながら回避しようとする少年がいて、彼は東京で何度も何度も同じ日に生きた。,デュラララ!!|東京リベンジャーズ,アニメ|アニメ,池袋において、カラーギャングの抗争や首なしライダーなど超常的な現象が相次いで確認された。|東京の不良グループによる連続抗争事件が、タイムリープ能力を持つ青年によって繰り返し回避が試みられた。,東京の人口が1200万人を突破し世界最大の都市圏に。池袋・渋谷が再開発の波を受けた。,ニコニコ動画・YouTubeが登場。ユーザー生成コンテンツが文化を変え、初音ミク文化の土台が生まれた。
85,2006年,2006.1,ドラマ,🗼,2006年の東京は内と外から同時に映された。アメリカの高校生が首都高速の地下ドリフトレースに飛び込む一方で、九州から呼び寄せたオカンを東京タワーが見える街で看取る息子の姿があり、渋谷の夜を彷徨う聴覚障害の女子高生が孤独な繋がりを求めていた。,ワイルド・スピードX3 TOKYO DRIFT|東京タワー オカンとボクと、時々、オトン|バベル,,アメリカから東京に転校してきた高校生が首都高速や繁華街の地下ドリフトレース世界に足を踏み入れ東京の夜景を背景に異文化がぶつかり合い友情が生まれた。|九州から上京し東京でひとり暮らしを続けてきた息子がガンを患ったオカンを東京に呼び寄せ東京タワーを望む街で母と息子は最後の日々を過ごした。|東京に暮らす聴覚障害を持つ女子高生が父親との断絶と孤独を抱えながら渋谷の夜の街を彷徨い刹那的な繋がりを求め続けた。,東京都内のマンション価格が上昇を始め都心部の再開発ラッシュが本格化した。東京タワー開業50周年。スカイツリーの建設計画が正式発表された。,ニコニコ動画創設前夜。東京発のオタク文化が「クール・ジャパン」として政策的に後押しされ始めた。倖田來未・大塚愛らがJ-POP市場を牽引した。
46,2007年,2007.0,コメディ,🚶,2007年の東京では「歩くこと」と「戦争」が奇妙な形をとった。借金を抱えた大学生が借金取りの中年男とともに東京の街を歩き奇妙な友情を育む一方、近郊の市街地ではとなり町との「戦争」が役所の担当者を通じて淡々と遂行され戦死者が出ても日常は続いた。,転々|となり町戦争,,借金を抱えた大学生が借金取りの中年男とともに東京の街を散歩し奇妙な友情を育んだ。|東京近郊の市街地で役所の担当者を通じてとなり町との「戦争」が淡々と遂行されていることが明らかになり戦死者が出ても日常は続いた。,安倍首相が就任し「美しい国づくり」を掲げた。東京都心の再開発が相次いだ。東京周辺で都市型水害が頻発し地下鉄・下水道の排水容量不足が深刻な問題となった。,YouTube元年。東京のサブカルが「カワイイ文化」として海外メディアに注目された。iPhone登場直前でmixiからTwitterへの移行期。
47,2008年,2008.0,ドラマ,🎹,リーマンショックの2008年、東京では見えないことと奇妙なことと壊れていくことが同時に起きていた。リストラされた男は家族に嘘をつき続け路上では人が突然変異する不可解な事件が相次ぎ、歓楽街に生きる若い女性は舌のピアスと刺青を纏いながら自己破壊の渦に沈んでいった。,トウキョウソナタ|TOKYO!|蛇にピアス,ドラマ|ドラマ,リーマンショック後の不況により会社を解雇されたサラリーマンがその事実を家族に隠したまま毎日公園に通い続けた。|東京の路上や室内で人が突然変異する事例を含む不可解な出来事が相次いで発生した。|東京の歓楽街に生きる若い女性が舌のピアスと刺青を身に纏いながら自己破壊的な欲望の渦に深く沈んでいった。,リーマンショック。東京の株式市場が急落し年越し派遣村が日比谷公園に設置された。東京の雇用が悪化し格差と欲望が交錯した。,AKB48が台頭し「会いに行けるアイドル」という新概念が東京発カルチャーになった。秋葉原を起点とした握手会・劇場文化がアイドル産業を塗り替えた。
48,2009年,2009.0,ドラマ,💊,2009年の東京の地下では二つの異なる漂流があった。歌舞伎町に潜り込んだ不法入国の中国人男性が裏社会の暴力に夢と誇りを砕かれ、新宿の夜のアンダーグラウンドではドラッグディーラーの青年がサイケデリックに彷徨い続けた。,エンター・ザ・ボイド|新宿インシデント,,ドラッグディーラーの青年が東京のアンダーグラウンドやナイトライフをサイケデリックに彷徨った。|不法入国した中国人男性が新宿・歌舞伎町に潜り込み地下経済に巻き込まれ日本の裏社会の暴力と欺瞞の中で夢と誇りが砕かれた。,民主党が政権を獲得。新宿歌舞伎町では中国・韓国系マフィアの摘発が相次ぎ外国人居住者を巡る問題が社会課題となった。ツイッターが日本で普及した。,初音ミク・ボカロ文化が本格化。秋葉原のオタク文化が世界的に認知された。2009年の歌舞伎町は「浄化作戦」後も独自の地下文化を維持し国際色豊かな街として映画・音楽・アートを発信した。
49,2010年,2010.0,SF,📱,2010年の秋葉原では、タイムマシンを手に入れた若者たちが何度も歴史をやり直し続けた。その裏側では、東京に迫る宇宙人の脅威を白黒の人物が一人で食い止めていた。タイムトラベルと宇宙戦争が同時進行する中、秋葉原の街はいつも通りメイドカフェが営業していた。,STEINS;GATE|ゼブラーマン,SF|アクション,千代田区秋葉原の雑居ビルにおいて、タイムマシンの開発に成功した集団が複数の世界線を往来し、歴史の改変を繰り返した。|東京において、白黒のコスチュームを纏った謎の人物が宇宙人の侵略を阻止するための戦闘に従事した。,東京スカイツリーの建設が進み、東京の新たなランドマークへの期待が高まった。,iPad登場。K-POPブームが東京で本格化。東方神起・少女時代が日本デビューし韓流第二波が到来した。
