id,yearDisplay,yearSort,genre,icon,events,movieList,movieGenres,movieEvents,realEvents,realCulture
143,1950年代〜1990年代,1950.0,ドラマ,🎭,任侠の一門に生まれ15歳で父を抗争で亡くした喜久雄が上方歌舞伎の名門に引き取られ東京の歌舞伎座を舞台に50年にわたって芸の道に命をかけた。,国宝,,,1945年の敗戦から高度成長・バブル崩壊まで激動の半世紀を経た東京。1951年に戦後再開した歌舞伎座は建て替えを重ねながら2013年に第五期が開場し伝統芸能の継承拠点として銀座に君臨し続けた。,吉田修一同名小説の映画化（2025年公開）。昭和から平成にかけて伝統芸能が観光資源・文化遺産として再評価される過程を50年のスケールで描く。
16,1950年代前半,1951.0,SF,🐺,第二次大戦でドイツの占領下におかれた「架空の戦後東京」において、特殊部隊「ケルベロス」と過激派による凄惨な市街戦や地下水路での銃撃戦が展開された。,人狼 JIN-ROH,,,朝鮮戦争の特需景気で東京の工業生産が回復。1952年にGHQ占領が終了し主権が回復された。,戦後復興期。テレビ放送開始前夜、ラジオドラマが全盛。美空ひばりが国民的スターとして登場した。
17,1952年,1952.0,ドラマ,🎠,末期ガンを宣告された市役所の課長が、お役所仕事を脱して公園建設に奔走した。,生きる,,,講和条約が発効し日本が主権を回復。東京では戦後復興の建設ラッシュが本格化した。,サンフランシスコ講和後の独立。手塚治虫「鉄腕アトム」連載開始。漫画文化の夜明けが始まった。
18,1953年,1953.0,ドラマ,🚂,戦後復興が進む東京に二つの傷が浮かんだ。尾道から上京した老夫婦は子供たちの慌ただしい生活の中に孤独を見出し、千住の「お化け煙突」が見える長屋では捨て子をめぐる戦争未亡人の家の亀裂と和解が静かに進んだ。,東京物語|煙突の見える場所,,尾道から上京してきた老夫婦が子供たちを訪ねるも近代化しつつある東京の生活の中で家族の絆の崩壊や孤独を感じた。|東京・千住の「お化け煙突」が見える長屋に捨て子が現れ赤ん坊の出所をめぐる夫婦の傷が露わになるが看病を通じて和解した。,NHKと日本テレビが東京でテレビ放送を開始。朝鮮戦争特需が続く復興期の下町では戦争の爪跡が生々しく残り未亡人・戦災孤児の問題が続いていた。,映画黄金時代の絶頂。年間入場者数11億人を突破し小津安二郎・黒澤明が世界的評価を得た。第3回ベルリン国際映画祭国際平和賞を「煙突の見える場所」が受賞した。
19,1954年,1954.0,SF,🦕,水爆実験によって目覚めた巨大怪獣（ゴジラ）が品川から上陸し、再建されたばかりの銀座の和光の時計塔や国会議事堂を破壊、火の海へと変えた。,ゴジラ,,,ビキニ環礁での水爆実験で第五福竜丸が被曝。東京でも反核署名運動が広がった。,力道山のプロレスがテレビで人気爆発。街頭テレビに群衆が集まり、東京の娯楽文化が大きく変わった。
20,1955年,1955.0,アクション,🎋,戦後の日本において、悪事を働く元軍人のアメリカ人ギャングが暗躍した。,竹の家,,,神武景気が始まり、東京の人口が800万人を突破。高度経済成長の端緒が開かれた。,神武景気の始まり。「太陽族」映画が話題に。三島由紀夫、松本清張ら文学も活況を呈した。
100,1956年,1956.0,ドラマ,💄,吉原の遊廓を舞台に、売春防止法施行直前の東京「赤線」地帯で働く五人の女性たちのそれぞれの生き方が交差した。,赤線地帯,,,1956年5月、売春防止法が制定（1958年施行）。東京オリンピック招致運動も始まり、急速な都市復興と道徳改造が進んだ。,「もはや戦後ではない」という言葉が象徴するように東京では高度成長前夜の消費文化が芽吹き始め、大衆娯楽が多様化した。
21,1958年,1958.0,ドラマ,🏗️,建設中の東京タワーを背景に、下町の夕日町三丁目で人情味あふれる人々が日常を営んでいた。,ALWAYS 三丁目の夕日,,,東京タワーが完成。高さ333mで当時の世界一の鉄塔として竣工した。,昭和33年は石原裕次郎・美空ひばりが映画・歌謡界に君臨し、東宝・日活の娯楽映画が黄金期を迎えた。下町の映画館では週替わりの新作に観客が集い、映画は庶民最大の娯楽だった。
22,1959年,1959.0,ドラマ,🚀,東京オリンピック開催が決定し、高度経済成長時代を迎えつつある夕日町三丁目で、芥川賞を目指す小説家や自動車修理工場の人々が生活していた。,ALWAYS 続・三丁目の夕日,,,1964年東京オリンピックの開催が決定。皇太子御成婚パレードが沿道100万人を集めた。,皇太子ご成婚パレードをテレビ中継。テレビが「一億総テレビ」の時代を決定的にした。
66,1960年代前半,1960.0,ドラマ,,高度経済成長期の東京郊外では、子供たちが「テレビを買わないなら口をきかない」と宣言し、団地の大人たちを困らせた。その同じ街の少し先では、娘を嫁に出した老父が一人の食卓でコップを傾けながら遠くを見つめていた。豊かさと喪失が同居する、静かな東京の日常だった。,お早よう|秋刀魚の味,ドラマ|ドラマ,東京郊外の団地において、テレビを買ってもらえない子供たちが「口をきかないストライキ」を起こし、近所の人間関係を揺さぶった。|高度経済成長期の東京に暮らす初老の男性が、嫁ぎ遅れた娘の縁談を進めながら、静かに自分の孤独と向き合った。,東京オリンピック開催決定を受け、都内で首都高速道路・地下鉄などの大規模インフラ整備が始まった。,石原裕次郎・吉永小百合ら映画スターが青春文化の偶像に。安保闘争後の「消費社会」が東京に到来した。
101,1960年,1960.5,ドラマ,🌙,安保闘争の余熱が冷めない1960年の東京は複数の顔を持った。銀座のバーでは30代の女性が自立と恋愛の間で揺れ続け、どこかでは透明人間と化した男が孤独な愛のために銀行強盗を繰り返し、公団の腐敗に父を殺された青年が権力の巨大な壁に挑んでいた。,女が階段を上る時|ガス人間第一号|悪い奴ほどよく眠る,,銀座のバーで雇われマダムとして働く30代の女性が男性客との恋愛と経済的自立の間で静かに揺れ動き続けた。|東京で、ガスを浴びて透明人間となった男が密かに愛する歌手のために銀行強盗を繰り返し孤独な悲劇が展開した。|土地開発公団の汚職で父を死に追いやられた西が副総裁の娘と偽装結婚して組織内部に潜入し巨大な官僚機構と企業の癒着を暴こうとする正義が巨大な壁に阻まれた。,1960年、安保闘争で国会周辺に数十万のデモ隊。岸内閣退陣後池田勇人が所得倍増計画を発表し高度成長が加速した。大規模な公団住宅・土地開発が進む一方官僚汚職・政治スキャンダルが相次いだ。,銀座は戦後東京のシンボルとして輝きバー・クラブ・映画館が林立した。東宝「変身人間シリーズ」が黄金期を迎え円谷英二特撮が日本独自のSF映画文化を形成した。
146,1961年,1961.0,コメディ,🏊,所得倍増計画で沸く1961年の東京では明るい表と暗い裏が同居した。慶應の若旦那がスポーツと恋愛に高度成長の青春を燃やす一方、新橋の雑踏でフィルムを拾ったポン引きが戦時中の上官の手がかりを追って暗黒街へ踏み込んだ。,大学の若大将|地獄の饗宴,,東京の大学水泳部に所属する老舗すき焼き屋の若旦那が頑固な父との確執を抱えながらスポーツと恋愛に高度成長期の青春を燃やした。|新橋駅の雑踏でフィルムを拾ったポン引きの修が戦時中の上官の手がかりを追って暗黒街へと踏み込み新橋ガード下・渋谷・両国を舞台に戦後の闇と欲望が交錯した。,高度成長が本格化し東京では大学進学率が上昇し若者文化が芽生えた。新橋の闇市跡が歓楽街として残存し戦争の記憶と現代が混在していた。,加山雄三「若大将シリーズ」が空前のヒット。岡本喜八監督による東宝アクション映画が実際のロケ地で臨場感を出した。高度成長期の楽観と戦後の影が交錯した年。
23,1962年,1962.0,ドラマ,🌟,東京都の人口が1000万人を突破した1962年、楽観と高揚が満ちていた。オリンピックに向けて国立競技場が改修され若者が希望に向かって歩む一方、大企業の株主総会ではお調子者のサラリーマンが奇策で財界をかき回した。,上を向いて歩こう|ニッポンの無責任時代,,オリンピックに向けてスタンドが増設された旧国立競技場を背景に若者たちが希望に向かって歩む姿が見られた。|お調子者のサラリーマン・平均がでたらめな行動力で太平洋酒の大株主工作から企業買収防衛まで巻き込まれながら東京の大企業ビルを舞台にのし上がった。,東京都の人口が1000万人を突破し世界最大級の都市圏を形成した。首都高速の建設が加速し地価高騰が始まった。高度成長期の財界では大企業間の合併・株式買収が活発化した。,週刊誌ブームと漫画誌の時代。クレージーキャッツ主演映画が空前の大ヒットを記録しサラリーマン文化と高度成長期の楽観主義を体現した。
24,1963年,1963.0,ドラマ,🦋,新幹線開通前夜の1963年の東京には二つの上昇と追跡があった。田舎から上京した女性が娼館のマダムへと這い上がる一方、横浜郊外の豪邸をめぐる身代金誘拐の捜査が東京・横浜の歓楽街・麻薬街へと広がった。,にっぽん昆虫記|天国と地獄,,東京タワー建設ブームと新幹線開通前夜の東京で田舎から上京した女性が娼館のマダムへと成り上がった。|横浜郊外の実業家の豪邸をめぐり誤って部下の子が誘拐され犯人はそれでも身代金を要求し捜査の舞台は東京・横浜の歓楽街から麻薬街へと広がった。,東海道新幹線の建設が佳境を迎え首都高速道路が部分開通。下町の急速な変貌が始まった。テレビアニメ「鉄腕アトム」が放送開始した。,手塚治虫「鉄腕アトム」TVアニメ放送開始で日本初の国産テレビアニメが全国へ普及した。「鉄腕アトム」と「天国と地獄」が同年、東宝・松竹の映画全盛期を象徴した。
25,1964年,1964.0,ドラマ,🏅,1964年の東京は、世界に向けて戦後復興の完成を宣言した。競技場では各国の選手が競い合い、その熱狂から少し外れた下町の路地では変わらぬ日常が淡々と続いていた。華やかな表舞台と静かな裏路地——それが東京という街の真実だった。,東京オリンピック|ALWAYS 三丁目の夕日'64,ドラマ|ドラマ,復興を遂げた東京で、戦後初の平和の祭典・東京オリンピックが開催された。|オリンピックの熱狂に包まれた東京の下町では、昭和の日常が静かに続いていた。,東京オリンピック開催。首都高速全線開通、東海道新幹線開業。戦後復興の完成が宣言された。,1964年、松竹・東宝・日活・大映・東映の5社が競作する娯楽映画の全盛期。東京の映画館動員数は史上最高水準に達し、テレビ普及とともに映画・歌謡曲・演劇が相乗りする大衆文化の絶頂期となった。
155,1960年代,1965.0,アニメ,🦡,多摩丘陵に暮らすタヌキたちが多摩ニュータウン開発による森の破壊に危機感を抱き化け学を復興させて宅地開発を阻止しようと奮闘するも文明の波に呑み込まれていく。,平成狸合戦ぽんぽこ,,,昭和40年代から始まった多摩ニュータウン計画（八王子・多摩・稲城・町田）により東京郊外の里山が大規模に開発された。,高度経済成長〜バブル期の自然破壊と開発優先社会への批判。失われた里山文化への哀愁と環境問題をジブリアニメの枠組みで描いた高畑勲の問題作。
149,1966年,1966.0,アクション,🎺,任侠の世界から足を洗おうとするヤクザ・哲也が対立組織の嫌がらせに絶対無抵抗を貫きながら東京から各地を流れ恋人を守ろうとするが組長の裏切りを知り銃弾で決着をつける。,東京流れ者,,,高度成長期の東京で暴力団の不動産進出が活発化。山口組が東京に進出した1960年代ヤクザ社会が激変した時代。,渡哲也の歌「東京流れ者」が38万枚ヒット。鈴木清順の「清順美学」と呼ばれる斬新な映像美が世界的に評価されラ・ラ・ランドもオマージュした。
26,1960年代後半,1967.0,ドラマ,✊,1960年代後半の新宿は時代が爆発していた。路上では若者が拳を振り上げ夜の歓楽街では退廃と自由が入り乱れた。その騒乱から少し離れた下町では女の子が日常を記憶に刻んでいた。大学の全共闘が熱に燃え消えた頃——東京郊外の空き地では子供たちが無邪気に「よげんの書」を描いていた。,新宿泥棒日記|薔薇の葬列|おもひでぽろぽろ|ノルウェイの森|20世紀少年,ドラマ|ドラマ|アニメ|ドラマ,新宿で、若者たちによるカウンターカルチャーと反体制の熱気が路上に溢れ出た。|新宿の歓楽街で、時代の変革期に翻弄された若者たちが自由と退廃の中を生きた。|昭和40年代の東京下町で、ひとりの少女がありふれた日常を生きた。|全共闘運動が渦巻く東京の大学街で、喪失を抱えた若者たちが恋をして死んでいった。|東京郊外の空き地で子供たちが空想で描いた「よげんの書」が数十年後に謎のカルト組織「ともだち」によって現実のものとされ幼馴染たちの戦いが始まった。,大学紛争が激化し東大・日大闘争が全国に波及。新宿駅西口で反戦フォークゲリラが活動。1969年東大安田講堂攻防戦で学生運動が実質的な終焉を迎えた。,フォークソング・グループサウンズ全盛。ザ・タイガース、ビートルズの影響が東京の若者文化を席巻した。
27,1970年代前半,1972.0,コメディ,🏮,葛飾区柴又において、テキ屋を稼業とする風来坊と彼を温かく迎える家族や下町の人々との人情劇が長年にわたり観測された。,男はつらいよ シリーズ,,,東大安田講堂事件が起き、同年の東大入試が中止された。学生運動が社会全体を揺るがした。,あさま山荘事件をテレビが生中継。学生運動の終焉とともに「しらけ世代」の文化が生まれた。
103,1972年,1972.5,ドラマ,✊,1972年2月のあさま山荘事件まで、東京・立川・群馬で展開した学生運動の内部崩壊と仲間への粛清が克明に記録された。革命を夢見た若者たちの惨劇。,実録・連合赤軍 あさま山荘への道程,,,1972年、連合赤軍があさま山荘に立て籠もりテレビ中継で全国が注目した。沖縄返還も実現し、政治の季節の終焉が近づいた。,安保闘争の熱が冷め、東京では「しらけ世代」が台頭。個人的な内面の探求へとカウンターカルチャーが転換した。
28,1973年,1973.0,SF,🌊,大規模な地殻変動により、東京を含む日本列島が海中へと沈没していく未曾有の大災害が発生した。,日本沈没（1973年版）,,,第一次石油ショック。東京でトイレットペーパーの買い占め騒動が起き、物価が急騰した。,テレビアニメ「マジンガーZ」でロボット文化が子供を席巻。「ノストラダムスの大予言」ブームが社会を覆った。
68,1974年,1974.0,サスペンス,🏙️,石油ショックに揺れる1974年の東京で二つの追跡と漂流があった。蒲田の操車場で発見された絞殺死体を追う刑事の捜査は全国に及び天才ピアニストの衝撃的な過去を暴く一方、安アパートに転がり込んだ若い男女がバイトと恋愛で70年代東京を漂っていた。,砂の器|赤ちょうちん,,東京・蒲田の国電操車場内で身元不明の中年男性の絞殺死体が発見され刑事2人による執念の捜査は全国各地の断片を繋ぎ合わせ天才ピアニストの衝撃的な犯行動機を暴いた。|東京の安アパートに転がり込んだ若い男女がバイト・恋愛・音楽を通じて70年代の東京での青春を刻んだ。,ニクソンショック・石油ショックで揺れる東京。田中角栄「列島改造論」への批判が高まり地価が高騰した。オイルショック後の物価高が若者の生活を直撃した。,ディスコ文化が東京に上陸。フォークが学生運動後の若者を慰め東京の音楽シーンが多様化した。1974年の東京では「ニューミュージック」が若者文化の中心となった。
29,1975年,1975.0,アクション,🚄,1975年の東京には、二種類の時限爆弾が同時に走っていた。一つは東海道新幹線の車内に仕掛けられた本物の爆弾であり、もう一つは新宿のヤクザ社会に積み重なった憎悪の爆発だった。どちらも東京発の暴力であり、どちらも誰かの孤独から生まれていた。,新幹線大爆破|仁義の墓場,アクション|アクション,東京発の新幹線に時限爆弾が仕掛けられ、大都市圏を巻き込むパニック事件が発生した。|新宿や府中を舞台に、ヤクザ組織の内部抗争による血みどろの事件が続発した。,ベトナム戦争が終結。日本の高度経済成長が終わり、低成長の安定期へと移行した。,キャンディーズ・山口百恵らアイドル文化が全盛。東京発のポップカルチャーが全国に波及した。
30,1976年,1976.0,SF,🤖,宇宙からの脅威に立ち向かうため、巨大ロボットが浅草の下町において激しい戦闘を展開した。,ジーマイン,,,ロッキード事件で田中角栄元首相が逮捕。東京地裁で戦後最大級の政治汚職裁判が始まった。,ピンク・レディー登場。コンビニが東京で急増し、24時間都市文化の基礎が作られた。
105,1977年,1977.0,ミステリー,🕵️,「Japan as No.1」が語られ始めた1977年の東京に二つの恐怖があった。新宿のホテルで刺殺された黒人青年の謎を追う刑事が国際化の陰に潜む闇を暴く一方、別の東京では山中の別荘を訪れた女子高生たちが少女の絵に宿る怪異に次々と飲み込まれていった。,人間の証明|ハウス,,新宿のホテルのエレベーターで刺殺された黒人青年の謎を追い警視庁刑事が東京の国際化の影に潜む闇を暴いた。|夏休みに山中の別荘を訪れた女子高生たちが少女の描いた絵に宿る怪異に次々と飲み込まれた。,福田赳夫内閣成立。「Japan as No.1」の時代が近づく中東京は国際都市としての顔を持ち始めた。角川書店のメディアミックス戦略による「角川映画」ブームが東京カルチャーを席巻した。,1977年、角川書店のメディアミックス戦略による「角川映画」ブームが東京のカルチャーを席巻。新興住宅地の開発が進み「マイホーム信仰」が強まった。
150,1978年,1978.0,アクション,🔫,財界の大物が次々と誘拐される東京で謎の殺し屋・鳴海昌平が財界会長から社長救出を5000万円で依頼される。冷徹なプロフェッショナルが組織的誘拐の背後に迫る。,最も危険な遊戯,,,1970年代後半の日本で企業誘拐・過激派テロが社会不安を引き起こした。連合赤軍事件（1972年）の余韻が続く中で民間警備産業が急成長した時代。,松田優作主演「遊戯シリーズ」第1作。東映が生み出した寡黙なハードボイルドヒーローが時代を席巻しアクション映画の様式を塗り替えた。
107,1979年,1979.0,アクション,💣,第二次オイルショックの1979年、東京の外縁では二つの極端な逸脱があった。中学教師が独力で原爆を製造し政府を脅迫する暴走と、福生の米軍基地そばでドラッグと快楽に溺れる若者たちの廃墟的な日常。どちらも既存の秩序の外側で東京を生きていた。,太陽を盗んだ男|限りなく透明に近いブルー,,東京の中学教師が独力でプルトニウムを入手して原爆を製造し政府を脅迫しストライキの中止や深夜放送の存続要求など社会を揺さぶる要求を突きつけた。|東京近郊の米軍基地・福生のそばでドラッグと音楽と快楽の中に浮遊する若者たちの退廃した日常が繰り広げられた。,第二次オイルショックが日本経済を直撃。東京では「省エネ」が合言葉となった。ソニーのウォークマン発売でパーソナル音楽文化が始まりディスコブームも最高潮に達した。,ウォークマン発売で東京の街で個人が音楽を楽しむ文化が始まった。村上龍の「限りなく透明に近いブルー」は1976年芥川賞受賞の問題作で東京郊外の退廃を描いた。
77,1980年,1980.0,ドラマ,🏥,東京都内に暮らす幼い少女が破傷風に感染した。壮絶な闘病が続く中、両親は極限の精神状態へと追い込まれていった。都市の中で孤立した家族が、恐怖と絶望に直面した。,震える舌,,,モスクワオリンピック日本不参加。山口百恵が引退し、東京・武道館でのラストコンサートに涙した。,山口百恵が引退し松田聖子が台頭した転換期。YMOが世界ツアーで日本の電子音楽を世界へ広めた。
78,1981年,1981.0,コメディ,🎙️,東京の下町で、落語家に弟子入りした若者が、師匠や仲間、ソープランドで働く女性との交流を通じて人生の機微を学んでいった。,の・ようなもの,,,第2次臨時行政調査会が設置。東京では財政再建問題が叫ばれ始めた。,YMO（坂本龍一・高橋幸宏・細野晴臣）が絶頂期。テクノポップが東京から世界へ発信された。
79,1983年,1983.0,ドラマ,🍽️,東京近郊のマンションに暮らす受験生の家庭に、型破りな家庭教師が雇われた。横並びに座る食卓を中心に、高度経済成長後の日本の核家族が抱える欺瞞と機能不全が鮮烈に解剖された。,家族ゲーム,,,東京ディズニーランドが開業。任天堂がファミコンを発売し、ゲームブームが始まった。,ファミコン発売。ゲーム文化が東京の子供たちの日常を根本から変えた転換点。
69,1984年,1984.0,コメディ,🍽️,バブル前夜の1984年の東京圏で生と死と家族が同時多発した。東京郊外ではラーメン職人が命をかけ別の家では葬式の段取りを知らない一家が泣き笑いし、さらに別の新興住宅地では念願のマイホームが祖父の同居を機に家族戦争の修羅場と化した。,タンポポ|お葬式|逆噴射家族,コメディ|コメディ,東京郊外の国道沿いに立つ寂れたラーメン店の再建をめぐり様々な人物が集まって奮闘した。|東京の某所において急死した家族の葬儀を初めて取り仕切ることになった一家が右往左往しながら三日間を過ごした。|東京郊外の新興住宅地に念願のマイホームを手にした一家が祖父の同居を機に崩壊し始め父の精神崩壊をきっかけに新居が家族戦争の修羅場と化した。,バブル直前の東京では地上げ問題が始まり下町の町並みが次々と取り壊された。東京郊外では宅地開発が急進し新浦安・多摩などの大規模団地や一戸建て住宅が急増した。,松田聖子・中森明菜がアイドル黄金時代を牽引。竹の子族が原宿で踊り若者サブカルが爆発した。マイホーム主義・核家族化の歪みが映画のテーマとして浮上した。
